{
  "format": "IWANNA_PREFAB_1",
  "pixelArt": true,
  "role": "trigger",
  "image": "demo_ring_plate.png",
  "width": 2.5,
  "height": 0.9,
  "collide": true,
  "detectionEnabled": true,
  "detectionX": 0,
  "detectionY": -0.55,
  "detectionW": 2.3,
  "detectionH": 1.1,
  "event": "delayed_laser",
  "effectAnchor": "laser_anchor",
  "effectPrefab": "laser_effect",
  "effectWidth": 3.2,
  "effectHeight": 8,
  "effectRotation": 0,
  "delay": 0.8,
  "damageStart": 0.1,
  "damageDuration": 0.8,
  "visualDuration": 1.1,
  "cooldown": 1,
  "sound": "trap_laser"
}
